{
    "InterfaceDescription": "Customer ACME // HQ",
    "InterfaceEncapsulation": {
        "EncapsulationType": "qinq",
        "Vlan1": 172,
        "Vlan2": 20
    },
    "InterfaceMTU": 90000,
    "InterfaceName": "GigabitEthernet0/2/0/10",
    "InterfaceQoS": {
        "EgressQoS": "500Mbps_GOLD_out",
        "IngressQoS": "500Mbps_GOLD_in"
    }
}
